<!ELEMENT dr:drivers (dr:driver*)>

<!ELEMENT dr:driver (dr:vehicle+, dr:homeaddress)>
<!ATTLIST dr:driver firstname CDATA #REQUIRED
lastname CDATA #REQUIRED
phone CDATA #REQUIRED
driverId ID #REQUIRED>

<!ELEMENT dr:vehicle EMPTY>
<!ATTLIST dr:vehicle type CDATA #REQUIRED>

<!ELEMENT dr:homeaddress (dr:street, dr:houseNo, dr:areacode, dr:town)>

<!ELEMENT dr:street (#PCDATA)>

<!ELEMENT dr:houseNo (#PCDATA)>

<!ELEMENT dr:areacode (#PCDATA)>

<!ELEMENT dr:town (#PCDATA)>